,Source,Title,Content,Section,URL,Date
0,Expansion,China avanza en su regulación para identificar el contenido hecho con IA,En el país asiático están buscando implementar medidas más duras y obligatorias para identificar el contenido generado a través de Inteligencia Artificial.,tecnologia,https://expansion.mx/tecnologia/2024/09/27/nuevo-reglamento-china-controlar-inteligencia-artificial,27/09/2024
1,Expansion,"En medio de la crisis, la industria del gaming busca un nuevo modelo de negocio","Los despidos han marcado el año de los videojuegos, pero especialistas apuntan que es una nueva oportunidad para diversificar el contenido y los creadores independientes.",tecnologia,https://expansion.mx/tecnologia/2024/09/27/crisis-industria-gaming-busca-nuevo-modelo-negocio,27/09/2024
2,Expansion,Oracle construirá un centro hyperscale en Nuevo León. ¿Qué es y cómo funcionará?,"Samuel García, gobernador del estado, resaltó que el proyecto estará enfocado en ayudar a las empresas de la entidad a eficientizar sus procesos informáticos.",tecnologia,https://expansion.mx/tecnologia/2024/09/26/oracle-construira-un-centro-hyperscale-en-nuevo-leon-que-es-y-como-funcionara,26/09/2024
3,Expansion,OpenAI planea reestructuración para ser una empresa con fines de lucro,Este cambio representaría una oportunidad para la startup de conseguir una mayor financiación para mantener el desarrollo de sus productos.,tecnologia,https://expansion.mx/tecnologia/2024/09/26/openai-planea-reestructuracion-para-ser-una-empresa-con-fines-de-lucro,26/09/2024
4,Expansion,Meta empareja a OpenAI y Google en la carrera de la IA,"Durante el evento Meta Connect, Mark Zuckerberg presentó las innovaciones en el sector que presentará para sus usuarios en los próximos meses.",tecnologia,https://expansion.mx/tecnologia/2024/09/26/meta-empareja-a-openai-y-google-en-la-carrera-de-la-ia,26/09/2024
5,Expansion,"Ante inconformidad de justicia mexicana, acreedores de TV Azteca inician proceso","La Secretaría de Economía informó que la disputa internacional contra México, por el impago de bonos de TV Azteca, acumula un costo por 150,000 dólares por el concepto de honorarios y el CIADI.",tecnologia,https://expansion.mx/tecnologia/2024/09/26/costo-mexico-arbitraje-acreedores-tv-azteca-eu,26/09/2024
6,Expansion,La identidad digital en la industria financiera: defensa y arma,"La biometría y criptografía reducen el riesgo de suplantación de identidad, pero también abre nuevos riesgos si no se hace adecuadamente.",tecnologia,https://expansion.mx/tecnologia/2024/09/26/la-identidad-digital-en-la-industria-financiera-defensa-y-arma,26/09/2024
7,Expansion,Estos son los juegos gratis de PlayStation Plus en octubre de 2024,Sony presentó el catálogo de videojuegos que llegarán a su suscripción y a partir de cuándo estarán disponibles.,tecnologia,https://expansion.mx/tecnologia/2024/09/25/juegos-gratis-ps-plus-octubre-2024,26/09/2024
8,Expansion,Caso FTX: el rol Caroline Ellison en el fraude y por el que pasará 2 años presa,"La exdirectora de Alameda Research, el fondo de cobertura personal de Bankman-Fried, también deberá pagar una multa de 11,000 mdd.",tecnologia,https://expansion.mx/tecnologia/2024/09/25/caso-ftx-caroline-ellison-fraude,25/09/2024
9,Expansion,Altán Redes confía en que el gobierno de Sheinbaum robustecerá la conectividad,"Carlos Lerma, CEO de Altán, dice estar “positivo de lo que vendrá en los próximos años” en conectividad, debido a que la provisión de internet será uno de los ejes principales de Claudia Sheinbaum.",tecnologia,https://expansion.mx/tecnologia/2024/09/25/altan-redes-confia-sheinbaum-robustecera-conectividad,25/09/2024
10,Expansion,"Mira Murati, CTO de OpenAI, deja la empresa","El 2024 ha sido un año complicado para la startup de Inteligencia Artificial, pues varios de sus ejecutivos y fundadores han renunciado.",tecnologia,https://expansion.mx/tecnologia/2024/09/25/mira-murati-cto-de-openai-deja-la-empresa,25/09/2024
11,Expansion,Telmex suspende a Sebog servicio de resguardo de información por impagos,"Triara, división de Centros de Datos de Telmex, suspendió los servicios de resguardo de información a Gobernación por el impago de 63.7 millones de pesos.",tecnologia,https://expansion.mx/tecnologia/2024/09/25/telmex-corta-servicio-segob,25/09/2024
12,Expansion,"Meta presenta el Quest 3S, la versión ""económica"" de su visor de realidad mixta",Meta calificó a este dispositivo como el proveedor de  “experiencias increíbles a un precio inigualable”.,tecnologia,https://expansion.mx/tecnologia/2024/09/25/meta-quest-3s-precio-y-specs,25/09/2024
13,Expansion,Google demanda a Microsoft por supuesto monopolio en la nube,"La denuncia fue presentada ante la Comisión Europea, según anunció el propio Google.",tecnologia,https://expansion.mx/tecnologia/2024/09/25/google-demanda-microsoft-monopolio-nube,25/09/2024
14,Expansion,YouTube lanza una nueva herramienta para ayudarte en una emergencia médica,"A través de su división Health, la plataforma de videos colaboró con instituciones certificadas, como la Cruz Roja, para dar información sobre situaciones de urgencia.",tecnologia,https://expansion.mx/tecnologia/2024/09/25/youtube-health-nueva-herramienta-para-emergencias-medicas,25/09/2024
15,Expansion,Samsung abre sus puertas: así conviven humanos y brazos mecánicos,"Lo que comenzó como una planta de producción de refrigeradores, hoy es uno de los centros más importantes para Samsung en el mundo.",tecnologia,https://expansion.mx/tecnologia/2024/09/25/samsung-abre-sus-puertas-asi-conviven-humanos-y-brazos-mecanicos,25/09/2024
16,Expansion,IFT prevé publicar nuevas medidas regulatorias para América Móvil en noviembre,El regulador tiene como obligación revisar cada dos años las medidas regulatorias de la compañía controlada por Carlos Slim para verificar si han generado competencia en las telecomunicaciones.,tecnologia,https://expansion.mx/tecnologia/2024/09/24/ift-preve-publicar-nuevas-medidas-regulatorias-america-movil,24/09/2024
17,Expansion,"El IFT pedirá 1,680 mdp de presupuesto pese a reforma para eliminar a autónomos",El regulador aseguró que la partida que solicitará a Hacienda es la misma que le fue aprobada para este año e incluso más baja si se toma en cuenta la inflación.,tecnologia,https://expansion.mx/tecnologia/2024/09/24/ift-pedira-1-680-mdp-de-presupuesto-pese-a-reforma,24/09/2024
18,Expansion,Meta sumará voces como la de John Cena a su chatbot,La nueva función de audio ofrecerá a los usuarios la opción de seleccionar una voz para su asistente digital.,tecnologia,https://expansion.mx/tecnologia/2024/09/24/meta-sumara-voces-como-la-de-john-cena-a-su-chatbot,24/09/2024
19,Expansion,"Microsoft confía en México; invertirá 1,300 mdd para ampliar su alcance en IA","El CEO de la compañía, Satya Nadella, destacó que este capital será para mejorar las capacidades de nube e IA en la región.",tecnologia,https://expansion.mx/tecnologia/2024/09/24/microsoft-invertira-1-300-mdd-mexico-ampliar-alcance-ia,24/09/2024
20,Expansion,Guía para elegir el mejor antivirus para tu celular,Los ataques a teléfonos inteligentes cada vez son más comunes y aquí te decimos qué debes tener en cuenta a la hora de elegir la mejor protección.,tecnologia,https://expansion.mx/tecnologia/2024/09/24/guia-para-elegir-el-mejor-antivirus-para-tu-celular,24/09/2024
21,Expansion,"La IA ayuda a las industrias a ahorrar hasta 35,000 dólares por hora","A través de diferentes sensores y softwares de IA, empresas como Tractian han logrado rastrear los sonidos de las máquinas e interpretarlas en posibles fallas técnicas.",tecnologia,https://expansion.mx/tecnologia/2024/09/24/asi-ayuda-ia-industrias-ahorrar-hasta-35-000-dolares,24/09/2024
22,Expansion,Netflix y Prime Video de Amazon lideran quejas del streaming,"A agosto de este año, ambas empresas recibieron inconformidades por parte de los usuarios por cobros indebidos y alteración de precios, aseguró Profeco a Expansión a través de transparencia.",tecnologia,https://expansion.mx/tecnologia/2024/09/23/plataformas-de-streaming-con-mas-quejas-profeco,23/09/2024
23,Expansion,¿Qué son y cómo funcionan las nuevas categorías de Canales en WhatsApp?,"Con la nueva organización del directorio de Canales, WhatsApp pretende hacer más sencilla la navegación para los usuarios.",tecnologia,https://expansion.mx/tecnologia/2024/09/23/nuevas-categorias-de-canales-en-whatsapp,23/09/2024
24,Expansion,"Intel, el nuevo objeto del deseo en la industria tech","La empresa pionera de la industria de los chips ha sido objeto de nuevos rumores sobre una posible adquisición por parte de Qualcomm, así como inversiones de firmas de capital.",tecnologia,https://expansion.mx/tecnologia/2024/09/23/intel-el-nuevo-objeto-del-deseo-en-la-industria-tech,23/09/2024
25,Expansion,"India, el país que quiere ser potencia en la industria de semiconductores","Estados Unidos y la India anunciaron una alianza para construir una planta de chips en este país, algo que el gobierno de Biden definió como un “punto de inflexión”.",tecnologia,https://expansion.mx/tecnologia/2024/09/23/india-quiere-ser-potencia-en-la-industria-de-semiconductores,23/09/2024
26,Expansion,AMLO busca convertir a CFE Telecom en una empresa pública,"La iniciativa de reforma quiere que CFE TEIT sea la principal compañía en proveer internet a todo el país, respecto a sus competidores, cambiando su estatus de estatal a pública.",tecnologia,https://expansion.mx/tecnologia/2024/09/23/amlo-busca-convertir-a-cfe-telecom-en-una-empresa-publica,23/09/2024
27,Expansion,CFE Telecom perfila a nuevo CEO para impulsar el proyecto de internet,"Según dos fuentes con conocimiento del tema, al interior de la compañía se ha puesto sobre la mesa el nombre de Emiliano Calderón Mercado para ser el nuevo CEO de la estatal de telecomunicaciones.",tecnologia,https://expansion.mx/tecnologia/2024/09/22/cfe-telecom-perfila-nuevo-ceo,22/09/2024
28,Expansion,Cómo Caliente pasó de anunciar apuestas a transmitir la Champions League,La compañía ha entrado a la ‘guerra del streaming deportivo’ para captar una parte de este nicho de mercado y con ello consolidar su principal negocio: las apuestas.,tecnologia,https://expansion.mx/tecnologia/2024/09/22/caliente-champions-league,22/09/2024
29,Expansion,Esta es la audiencia que quiere conquistar el iPhone 16,"Apple es consciente de que muchos usuarios de iPhone 15 difícilmente van a renovar su smartphone, pero hay un segmento al que pueden seducir.",tecnologia,https://expansion.mx/tecnologia/2024/09/20/iphone-16-esta-es-la-audiencia-que-quiere-conquistar,20/09/2024
30,Expansion,Microsoft usará energía nuclear para alimentar su Inteligencia Artificial,El acuerdo entre Microsoft y Constellation Energy permitirá reactivar una unidad de la planta nuclear Three Mile Island para cubrir las crecientes necesidades energéticas.,tecnologia,https://expansion.mx/tecnologia/2024/09/20/microsoft-energia-nuclear-inteligencia-artificial,20/09/2024
31,Expansion,La ONU formula siete recomendaciones para regular la IA,La ONU creó el año pasado un órgano consultivo de 39 miembros para abordar los problemas de la regulación internacional de la IA.,tecnologia,https://expansion.mx/tecnologia/2024/09/20/la-onu-formula-siete-recomendaciones-para-regular-la-ia,20/09/2024
32,Expansion,"La IA decide si eres o no apto para un trabajo, ¿qué hacer para que te vea?","Aunque la IA sí ha demostrado que puede ser una aliada en los espacios donde se aplica, los sesgos que puede presentar aún son un inconveniente.",tecnologia,https://expansion.mx/tecnologia/2024/09/20/la-ia-decide-si-eres-o-no-apto-para-un-trabajo-que-hacer-para-que-te-vea,20/09/2024
33,Expansion,Amazon Prime y MGM Studios se unen a la MPA,Las empresas de entretenimiento se unen a otras como Netflix o Paramount Pictures.,tecnologia,https://expansion.mx/tecnologia/2024/09/19/amazon-prime-y-mgm-studios-se-unen-a-la-mpa,19/09/2024
34,Expansion,Amazon lanza un nuevo bot que te ayudará a crecer las ventas,La empresa dio a conocer a Amelia para obtener los datos de venta e inventario de un negocio que está en la plataforma.,tecnologia,https://expansion.mx/tecnologia/2024/09/19/amazon-lanza-un-nuevo-bot-que-te-ayudara-a-crecer-las-ventas,19/09/2024
35,Expansion,PlayStation lanza edición limitada con aspecto noventero,"Esta consola evoca al aspecto del primer equipo, lanzado por Sony en 1994, y forma parte de la celebración por sus 30 años.",tecnologia,https://expansion.mx/tecnologia/2024/09/19/playstation-lanza-edicion-limitada-30-aniversario,19/09/2024
36,Expansion,Usuarios reportan que la alerta sísmica nunca llegó a sus celulares,El IFT había asegurado que hoy las empresas enviarían mensajes de emergencia por sismos pero nunca llegaron. Telcel asegura que las alertas dependen del regulador.,tecnologia,https://expansion.mx/tecnologia/2024/09/19/por-que-no-me-llego-mensaje-alerta-sismica-celular,19/09/2024
37,Expansion,TelevisaUnivision nombra como nuevo CEO a un exdirectivo de Google,"Se trata de Daniel Alegre, en sustitución de Wade Davis,  quien cuenta con una amplia experiencia en empresas de tecnología y trabajando con la comunidad hispana en EU, México y América Latina.",tecnologia,https://expansion.mx/tecnologia/2024/09/19/televisaunivision-nuevo-ceo-exdirectivo-de-google,19/09/2024
38,Expansion,Inversión en conectividad no caerá pese a política judicial: Neutral Networks,"El CEO de la compañía Neutral Networks, enfocada en infraestructura crítica, dijo que la necesidad de conectividad a nivel usuario como empresa será más fuerte que agendas políticas.",tecnologia,https://expansion.mx/tecnologia/2024/09/19/reforma-judicial-riesgo-confianza-invertir-telecomunicaciones,19/09/2024
39,Expansion,Nintendo y The Pokémon Company demandan al creador de Palworld,"Las empresas japonesas iniciaron una acción legal en contra de Pocketpair, debido a infracciones de patentes al desarrollar el llamado “Pokémon con armas”.",tecnologia,https://expansion.mx/tecnologia/2024/09/19/nintendo-y-the-pokemon-company-demandan-al-creador-de-palworld,19/09/2024
40,Expansion,TelevisaUnivisión sustituirá a Wade Davis como director general,La empresa decidió sustituir a Davis por Daniel Alegre debido a algunos de los resultados de la compañía que cayeron por debajo de las expectativas internas.,tecnologia,https://expansion.mx/tecnologia/2024/09/18/televisaunivision-sustituira-a-wade-davis-como-director-general,19/09/2024
41,Expansion,YouTube presenta IA para hacer videos y ganar ‘más’ dinero,La empresa llevo a cabo Made on YouTube un evento donde también señaló que el número de creadores que obtienen la mayor parte de sus ingresos viene de TV.,tecnologia,https://expansion.mx/tecnologia/2024/09/18/youtube-presenta-ia-para-hacer-videos-y-ganar-mas-dinero,18/09/2024
42,Expansion,La IA generativa transforma la operación y los ingresos empresariales,"El uso de IA generativa ha crecido en diversos sectores, impulsando la innovación y facilitando nuevas formas de operar en las organizaciones.",tecnologia,https://expansion.mx/tecnologia/2024/09/18/ia-generativa-transforma-operacion-e-ingresos-empresariales,18/09/2024
43,Expansion,Amazon agrega a PayPal como método de pago en pedidos de Comprar con Prime,"Esta nueva opción estará disponible para los usuarios que realicen compras en sitios web de terceros, con membresía Prime.",tecnologia,https://expansion.mx/tecnologia/2024/09/18/amazon-agrega-a-paypal-como-metodo-de-pago-prime,18/09/2024
44,Expansion,"Google se salva de una multa antimonopolio de 1,670 mmd",El caso comenzó por un supuesto dominio anticompetitivo de la empresa en el mercado de la publicidad en línea.,tecnologia,https://expansion.mx/tecnologia/2024/09/18/google-se-salva-de-una-multa-presunto-monopolio,18/09/2024
45,Expansion,El e-commerce chino conquista las bolsas de valores,"Los dueños de Alibaba, Temu y JD conquistan el e-commerce del mundo, mientras diversifican sus negocios.",tecnologia,https://expansion.mx/tecnologia/2024/09/18/el-e-commerce-chino-conquista-las-bolsas-de-valores,18/09/2024
46,Expansion,El gasto de consumidores en EU aumenta en agosto; la inflación se desacelera,"El gasto de los consumidores sigue apoyándose en ganancias salariales aún sólidas, a pesar de que el mercado laboral se ha ralentizado considerablemente.",economia,https://expansion.mx/economia/2024/09/27/gasto-consumidores-eu-aumenta-agosto-inflacion-desacelera,27/09/2024
47,Expansion,"México registra déficit comercial de 4,868 mdd en agosto","Las exportaciones mexicanos cayeron 1% y las importaciones crecieron 5.7%, de acuerdo con el Inegi.",economia,https://expansion.mx/economia/2024/09/27/balanza-comercial-mexico-agosto-2024-inegi,27/09/2024
48,Expansion,Banxico mantendrá prudencia y cerrará el año con tasa en 10%,Los analistas consideran que el mensaje del banco central es más laxo que la decisión de agosto y esperan que haya dos recortes más de 25 puntos base.,economia,https://expansion.mx/economia/2024/09/27/banxico-mantendra-prudencia-y-cerrara-el-ano-con-tasa-en-10,27/09/2024
49,Expansion,Banxico ejecuta nuevo recorte a la tasa a 10.5%,El banco central hizo un segundo recorte consecutivo a la tasa de referencia en un contexto de menor inflación.,economia,https://expansion.mx/economia/2024/09/26/banxico-recorta-tasa-de-referencia-segunda-ocasion,26/09/2024
50,Expansion,Janet Yellen se opone a reducir requisitos de capital para bancos,La secretaria del Tesoro de Estados Unidos pidió seguir trabajando para que el sistema financiero sea resistente a los tiempos de turbulencias.,economia,https://expansion.mx/economia/2024/09/26/yellen-se-opone-bajar-capital-bancos,26/09/2024
51,Expansion,Claudia Sheinbaum recibe una economía tocada por la incertidumbre,El paquete de 20 reformas que presentó AMLO en febrero de este año amenaza con limitar el crecimiento potencial de México.,economia,https://expansion.mx/economia/2024/09/26/sheinbaum-recibe-economia-incertidumbre-reformas,26/09/2024
52,Expansion,Búsqueda de un segundo empleo se dispara en varias entidades; Morelos encabeza,"En México, dentro de la población subocupada, 328,971 personas están en condición de búsqueda de trabajo adicional, indican cifras del Inegi del segundo trimestre de 2024.",economia,https://expansion.mx/economia/2024/09/26/busqueda-segundo-empleo-se-dispara-varias-entidades,26/09/2024
53,Expansion,Es poco probable que México pierda grado de inversión: Moody's,"La agencia señala que un mayor déficit fiscal, absorber deuda de Pemex y un bajo crecimiento sí pueden impactar su calidad crediticia.",economia,https://expansion.mx/economia/2024/09/25/poco-probable-mexico-pierda-grado-inversion-moodys,25/09/2024
54,Expansion,Revolut planea operar en los primeros meses de 2025,"Juan Guerra, director general de la firma, dijo que espera arrancar operaciones el siguiente año con una cuenta de débito nivel 4 y transferencias internacionales.",economia,https://expansion.mx/economia/2024/09/25/revolut-planea-operar-en-los-primeros-meses-de-2025,25/09/2024
55,Expansion,"Pemex requerirá 50,200 mdd en los tres primeros años de Sheinbaum, prevé Moody's","Sin el apoyo del gobierno la calificación real de Pemex sería una Ca, es decir con un 80% de incumplimiento de sus compromisos financieros.",economia,https://expansion.mx/economia/2024/09/25/pemex-requerira-50-200-mdd-primeros-anos-sheinbaum-moodys,25/09/2024
56,Expansion,La Condusef alerta por suplantación de identidad de 24 financieras,Veinticuatro instituciones debidamente constituidas han reportado la suplantación de su identidad para cometer fraudes entre los usuarios.,economia,https://expansion.mx/economia/2024/09/25/condusef-alerta-por-suplantacion-de-identidad-de-financieras,25/09/2024
57,Expansion,¿Abren los bancos el 1 de octubre? Esto dice el calendario de la CNBV,"El 1 de octubre, Claudia Sheinbaum toma posesión como la primera presidenta de México, esto implica un suceso de trascendencia nacional, por lo cual la mayoría de los empleados descansará.",economia,https://expansion.mx/economia/2024/09/25/abren-bancos-1-octubre-2024-calendario-cnbv,25/09/2024
58,Expansion,Mercado Pago lo hace oficial: presentó solicitud para ser banco digital,La cuenta digital busca la aprobación de licencia bancaria ante la Comisión Nacional Bancaria y de Valores para ofrecer servicios de banca múltiple.,economia,https://expansion.mx/economia/2024/09/25/mercado-pago-banco-mexico-permiso-cnbv,25/09/2024
59,Expansion,Banxico sólo tiene espacio para hacer recorte de 25 puntos,Los analistas consideran que el banco central debe tener cautela al bajar tasas en periodos de volatilidad y descartan que hagan un recorte de 50 puntos como lo hizo la Reserva Federal.,economia,https://expansion.mx/economia/2024/09/25/por-que-banxico-no-puede-hacer-recortes-50-puntos-tasa,25/09/2024
60,Expansion,La OCDE ajusta a la baja su previsión del PIB para México,"De acuerdo con el organismo, la economía mexicana crecerá 1.4% este año, 0.8% menos que en la previsión anterior.",economia,https://expansion.mx/economia/2024/09/25/ocde-crecimiento-pib-mexico-2024-1-4,25/09/2024
61,Expansion,BBVA mantiene su confianza en México ante la transición presidencial,"El país sigue siendo atractivo a largo plazo gracias a su estructura de costos y apalancamiento en comparación con Estados Unidos, dijo Onur Genç, consejero delegado de BBVA.",economia,https://expansion.mx/economia/2024/09/25/bbva-mantiene-su-confianza-en-mexico-ante-la-transicion-presidencial,25/09/2024
62,Expansion,China recorta otra tasa de interés para impulsar la economía,"El interés de los préstamos a un año concedidos a las instituciones financieras se redujo del 2.3 al 2%, informó el banco central.",economia,https://expansion.mx/economia/2024/09/25/china-recorta-otra-tasa-de-interes-para-impulsar-la-economia,25/09/2024
63,Expansion,La austeridad selectiva predominó en el gobierno de AMLO,"Más que recortes a gastos onerosos o generar ahorros, el gasto público llegó a niveles récord, obedeciendo a prioridades y obligaciones del gobierno a cargo de Andrés Manuel López Obrador.",economia,https://expansion.mx/economia/2024/09/25/austeridad-gobierno-amlo,25/09/2024
64,Expansion,Mexicanos gastan 12% más en bebidas energéticas,Datos de Kantar muestran que en los últimos años ha aumentado tanto el número de litros comprados como el precio de este tipo de bebidas.,economia,https://expansion.mx/economia/2024/09/24/mexicanos-gastan-12-mas-en-bebidas-energeticas,24/09/2024
65,Expansion,Trump amaga con arancel de 100% a autos que entren por la frontera con México,El candidato presidencial dijo que la única manera de que se libren de esa cuota es si quieren construir una planta en Estados Unidos.,economia,https://expansion.mx/economia/2024/09/24/trump-amaga-arancel-100-autos-entren-frontera-mexico,24/09/2024
66,Expansion,"Cetes a dos años reducen rendimientos a un dígito, anticipa recorte de Banxico","Todos los plazos de los Cetes redujeron sus ganancias, pero el plazo de dos años ofrece la tasa más baja de 9.92%, a la espera de que Banxico haga un nuevo recorte.",economia,https://expansion.mx/economia/2024/09/24/cetes-a-dos-anos-reducen-rendimientos-a-un-digito-anticipa-recorte-de-banxico,24/09/2024
67,Expansion,Openbank lanza su lista de espera para clientes mexicanos,Openbank México abre en su sitio web la lista de espera para aquellos usuarios que quieran acceder a la oferta de este nuevo banco digital.,economia,https://expansion.mx/economia/2024/09/24/openbank-lanza-lista-de-espera-para-clientes-mexicanos,24/09/2024
68,Expansion,"Banco Mundial logra récord de 56,000 mdd en inversiones CFI","Para el ejercicio financiero que finalizará en julio de 2025, el Banco Mundial buscará centrar sus esfuerzos en infraestructura, particularmente en carreteras y transporte.",economia,https://expansion.mx/economia/2024/09/24/banco-mundial-creditos-cfi-record-56-000-mdd,24/09/2024
69,Expansion,China presenta medidas de relajación monetaria para reactivar la economía,"El Banco Popular de China recortará el tipo de interés de las operaciones dobles a siete días en 0.2 puntos porcentuales, hasta el 1.5%.",economia,https://expansion.mx/economia/2024/09/24/china-presenta-medidas-reactivacion-de-economia,24/09/2024
70,Expansion,"Inflación sigue a la baja, en la primera mitad de septiembre se ubicó en 4.66%","El índice subyacente terminó la primera quincena de septiembre en 3.95% y el no subyacente en 6.73%, de acuerdo con datos publicados por el Inegi.",economia,https://expansion.mx/economia/2024/09/24/inflacion-en-mexico-sigue-a-la-baja-inpc-septiembre,24/09/2024
71,Expansion,"Fomentar vivienda de interés social y eliminar corrupción, retos del Infonavit","Analistas señalan que el instituto tiene pendientes en materia de avanzar en la digitalización y la agilización de trámites, así como en mejorar los rendimientos en la subcuenta de vivienda.",economia,https://expansion.mx/economia/2024/09/24/pendientes-logros-infonavit,24/09/2024
72,Expansion,Denuncian a Visa por monopolio en Estados Unidos,"El Departamento de Justicia de Estados Unidos busca denunciar a la empresa  por monopolio en el mercado de tarjetas de débito, de acuerdo con un reporte de Blomberg.",economia,https://expansion.mx/economia/2024/09/23/denuncian-a-visa-por-monopolio-en-estados-unidos,24/09/2024
73,Expansion,Empresas de EU reactivarán anuncios de inversión; confían en Sheinbaum,"Tras detener un anuncio importante de inversión por la reforma judicial, la American Society of Mexico informó que en próximas fechas se retomará, pero con cautela.",economia,https://expansion.mx/economia/2024/09/23/empresas-de-eu-reactivaran-anuncios-de-inversion-confian-en-sheinbaum,23/09/2024
