,Source,Title,Content,Section,URL,Date
74,Expansion,El endeudamiento de mexicanos en el exterior representa 35% del PIB,El Banco de México (Banxico) dio a conocer que en el segundo trimestre del año se redujo el endeudamiento del mundo desde el 42% reportado en el primer trimestre.,economia,https://expansion.mx/economia/2024/09/23/deuda-de-mexicanos-en-el-exterior-representa-35-del-pib,23/09/2024
75,Expansion,Las auditorías dan ingresos por 3.5 billones de pesos al SAT,"De estos recursos, 1.426 billones de pesos se obtuvieron por auditorías a grandes contribuyentes, informa el fisco.",economia,https://expansion.mx/economia/2024/09/23/auditorias-dan-al-sat-ingresos-por-3-5-billones-de-pesos,23/09/2024
76,Expansion,Economía mexicana crece 0.6% en julio,Las actividades primarias encabezaron el crecimiento económico del país durante el séptimo mes del año.,economia,https://expansion.mx/economia/2024/09/23/economia-mexicana-crece-tercer-mes-consecutivo,23/09/2024
77,Expansion,Una jubilación digna se complica cada vez más para los mexicanos,"Una quinta parte de los empleados en el país contempla jubilarse a los 66 años o más, mientras que otro 86% admite ahorrar menos de lo que debería hacerlo en la actualidad.",economia,https://expansion.mx/economia/2024/09/23/jubilacion-digna-se-complica-para-los-mexicanos,23/09/2024
78,Expansion,El plan de sustituir importaciones de Asia con el nearshoring se torna difícil,"En los primeros siete meses del año, las importaciones de México desde Asia alcanzaron los 141,219 millones de dólares; China representa 51% del total.",economia,https://expansion.mx/economia/2024/09/23/plan-sustituir-importaciones-asia-nearshoring-dificil,23/09/2024
79,Expansion,Carlos Slim critica el sistema de pensiones en México y pide combatir la pobreza,El hombre más rico de México dice que los recursos que reciben actualmente los mayores de 65 años debería usarse para sacar a 6 millones de personas de la pobreza extrema.,economia,https://expansion.mx/economia/2024/09/22/carlos-slim-critica-pensiones,22/09/2024
80,Expansion,"Anuncios de inversión en México suman 59,900 mdd en primeros nueve meses de 2024",La Secretaría de Economía identifica 197 anuncios públicos entre enero y septiembre. Estados Unidos encabeza los anuncios.,economia,https://expansion.mx/economia/2024/09/22/anuncios-de-inversion-en-mexico-suman-59-900-mdd-en-primeros-nueve-meses-de-2024,22/09/2024
81,Expansion,China sufre por exceso... de leche,"El mercado de leche en China enfrenta una situación complicada por el exceso de oferta, la baja demanda y las pérdidas millonarias.",economia,https://expansion.mx/economia/2024/09/20/china-sufre-por-exceso-de-leche,20/09/2024
82,Expansion,"EU pide ""implementación rigurosa"" de plan de certificación de aguacate de México","Las ventas de aguacate mexicano a Estados Unidos se han disparado 48% desde 2019, hasta alcanzar un valor de más de 3,000 millones de dólares el año pasado.",economia,https://expansion.mx/economia/2024/09/20/eu-implementacion-rigurosa-certificacion-aguacate-mexico,20/09/2024
83,Expansion,Banqueros piden evitar arbitraje regulatorio con licencias bancarias,El presidente de la ABM dijo que los productos que ofrece cada una de las instituciones financieras deben tener una regulación igual para mantener el incentivo de inversión en el país.,economia,https://expansion.mx/economia/2024/09/20/banqueros-evitar-arbitraje-regulatorio-licencias-bancarias,20/09/2024
84,Expansion,Banqueros esperan que leyes secundarias de reforma judicial den certidumbre,"Tras la aprobación de la reforma al Poder Judicial,  los banqueros esperan que en las leyes secundarias se afinen detalles que permitan una reforma ""exitosa"".",economia,https://expansion.mx/economia/2024/09/20/banqueros-leyes-secundarias-certidumbre-reforma-judicial,20/09/2024
85,Expansion,Eliminación de subsidios a gasolinas impedirá bajas en sus precios,"La medida de disminución de los estímulos fiscales obedece más a la necesidad de incrementar la recaudación de impuestos para reducir el déficit fiscal, consideran especialistas.",economia,https://expansion.mx/economia/2024/09/20/por-que-no-baja-el-precio-de-la-gasolina-en-mexico,20/09/2024
86,Expansion,México impugnará fallo que determina pago de 37 mdd a Odyssey Marine Exploration,"La empresa estadounidense ganó un arbitraje internacional contra México, pues se consideró que Semarnat negó arbitrariamente un permiso para un proyecto minero marino en Baja California Sur.",economia,https://expansion.mx/economia/2024/09/19/mexico-impugnara-fallo-pago-de-37-mdd-odyssey-marine,20/09/2024
87,Expansion,El 24% de los créditos hipotecarios es cofinanciado con Infonavit y Fovissste,"La Asociación de Bancos de México dijo que de enero a julio de este año, 16,100 créditos que ha dado la banca han tenido cofinanciamiento con los institutos para trabajadores.",economia,https://expansion.mx/economia/2024/09/19/creditos-hipotecarios-cofinanciados-infonavit-fovissste,19/09/2024
88,Expansion,"Yellen considera ""señal muy positiva"" recorte de tasas de la Fed","La medida ""refleja confianza de parte de la Fed en que la inflación cedió y está en camino hacia la meta de 2% (anual)"", expresó la secretaria del Tesoro de EU.",economia,https://expansion.mx/economia/2024/09/19/yellen-considera-senal-muy-positiva-recorte-de-tasas-de-fed,19/09/2024
89,Expansion,La CNBV buscará regular reportes de ciberseguridad,El regulador busca que todas las empresas que ofrezcan un servicio financiero deban homologar los criterios para reportar cuando han sido víctimas de un ataque cibernético.,economia,https://expansion.mx/economia/2024/09/19/la-cnbv-buscara-regular-reportes-de-ciberseguridad,19/09/2024
90,Expansion,Recorte de la Fed da margen de maniobra a Banco de México,"Tras la decisión de política monetaria del banco central estadounidense, Banxico tiene oportunidad de mantener el amplio diferencial de tasas, aseguran analistas.",economia,https://expansion.mx/economia/2024/09/19/recorte-fed-margen-maniobra-banxico-politica-monetaria,19/09/2024
91,Expansion,Claudia Sheinbaum se reunirá con empresarios de Estados Unidos en octubre,"En medio de voces empresariales que dicen que las inversiones se han detenido por la reforma judicial, Marcelo Ebrard anunció la asistencia de la próxima presidenta de México en el CEO Dialogue.",economia,https://expansion.mx/economia/2024/09/18/ebrard-anuncia-sheinbaum-reunion-empresas-de-eu,18/09/2024
92,Expansion,¿Dónde hay mayor brecha salarial por género en México?,"Banxico realizó un análisis de las brechas salariales de género en las regiones de México, los resultados demuestran que el norte es donde hay mayor diferencia de remuneración entre hombres y mujeres.",economia,https://expansion.mx/economia/2024/09/18/brecha-salarial-por-genero-en-mexico,18/09/2024
93,Expansion,¿Por qué es importante tener un seguro para tu negocio?,"Un seguro no solo cubre los daños materiales, sino que también puede asegurar la continuidad de las operaciones en caso de un siniestro, destaca la AMIS.",economia,https://expansion.mx/economia/2024/09/18/por-que-es-importante-tener-un-seguro-para-tu-negocio,18/09/2024
94,Expansion,Peligra economía de México si Trump gana y cumple con aranceles: Moody's,La agencia calificadora anticipa que la economía mexicana sufriría una recesión en 2025 y una mayor inflación.,economia,https://expansion.mx/economia/2024/09/18/economia-de-mexico-peligra-recesion-si-gana-trump,18/09/2024
95,Expansion,"RappiCard alcanza los 5,107 millones de pesos en su cartera de crédito",La empresa resalta que parte de su estrategia es ofrecer un proceso de solicitud y aprobación en solo dos minutos y una entrega de la tarjeta física en 30 minutos.,economia,https://expansion.mx/economia/2024/09/18/rappicard-alcanza-5107-mdp-cartera-de-credito,18/09/2024
