Source,Title,Content,Section,URL,Date
La Jornada,Lucía García rescata a Rayadas,"Como una de las jugadoras de mayor jerarquía internacional, la española Lucía García rescató al campeón Monterrey para conseguir un agónico empate 1-1 ante León en el estadio Nou Camp. Las Rayadas, que han sufrido en el torneo Clausura 2024 de la Liga Mx Femenil, desplazaron al América del tercer puesto con 26 unidades después de 12 jornadas, al tiempo que las Esmeraldas tienen 12 puntos.",Deportes,https://www.jornada.com.mx/2024/09/28/deportes/a09n2dep?partner=rss,28/09/2024
La Jornada,Título de la Copa de Campeones motiva  al América para duelo ante Pumas: Dávila,"La reciente obtención del título de la Copa de Campeones es un factor que motiva al América de cara al clásico capitalino de este domingo ante Pumas, aseguró el delantero Víctor Dávila, quien además indicó que más allá de tratar de derrotar a uno de sus acérrimos rivales, su equi-po buscará a toda costa el triun-fo para ubicarse en zona de liguilla.",Deportes,https://www.jornada.com.mx/2024/09/28/deportes/a09n1dep?partner=rss,28/09/2024
La Jornada,Liga Mexicana de Beisbol elige   a Trevor Bauer pitcher del año,"Trevor Bauer es un coleccionista de galardones. El lanzador de los Diablos Rojos del México, campeón de juegos ganados y ponches en la pasada temporada, fue elegido como pitcher del año en la Liga Mexicana de Beisbol (LMB).",Deportes,https://www.jornada.com.mx/2024/09/28/deportes/a11n2dep?partner=rss,28/09/2024
La Jornada,Finaliza la  temporada para Rodri,"Manchester. Rodri, mediocampista del Manchester City, se perderá el resto de la temporada tras someterse ayer a una cirugía en el ligamento anterior cruzado.",Deportes,https://www.jornada.com.mx/2024/09/28/deportes/a10n3dep?partner=rss,28/09/2024
La Jornada,Del Toro finaliza sexto en la prueba de ruta del Mundial juvenil,"Isaac del Toro cada vez se acerca más a la perfección para seguir acrecentando su legado. Ahora, el mexicano culminó en el sexto lugar de la prueba de ruta Sub-23 del Mundial de Ciclismo de Zúrich Suiza, después de una extraordinaria actuación en la cual sólo erró al bajar el ritmo en el tramo final. Aún cuando se quedó cerca de la medalla impuso el mejor tiempo para un tricolor en esta carrera.&#160;",Deportes,https://www.jornada.com.mx/2024/09/28/deportes/a11n1dep?partner=rss,28/09/2024
La Jornada,Tigres rescata el empate a dos con León; es sublíder,"Con polémicas decisiones arbitrales, Tigres rescató el empate 2-2 ante el León con un gol de último minuto del argentino Juan Brunetta. Los universitarios se valieron del criterio del silbante Daniel Quintero Huitrón, quien invalidó dos tantos de los esmeraldas e inclinó la balanza a su favor, para igualar el encuentro.",Deportes,https://www.jornada.com.mx/2024/09/28/deportes/a27n1dep?partner=rss,28/09/2024
La Jornada,México busca ser el máximo exponente en la Homeless Cup,"Luego de un largo viaje a Corea del Sur, las selecciones mexica-nas de futbol de calle cumplieron el objetivo de estar en la final de la Homeless World Cup y están a un pasó de convertirse en los máximos exponentes de este torneo.",Deportes,https://www.jornada.com.mx/2024/09/28/deportes/a10n1dep?partner=rss,28/09/2024
La Jornada,UEFA sanciona al Barça por pancarta con expresión nazi,"Madrid. El Órgano de Control, Ética y Disciplina (CEDB, por sus siglas inglés) de la UEFA sancionó al Barcelona con 11 mil 162 dólares al resolver que su afición tuvo una conducta racista en el partido de Champions contra el AS Mónaco, el pasado 17 de abril en el Stade Louis II.",Deportes,https://www.jornada.com.mx/2024/09/28/deportes/a10n2dep?partner=rss,28/09/2024
La Jornada,Carlos Fernández-Vega: México SA,"A lo largo de su prolongada cuan    devastadora estancia en Los Pinos (1982-2018), los seis gobiernos tecnocráticos coleccionaron un rosario de frases verdaderamente imbéciles en su intento por justificar sus políticas públicas hambreadoras y decisiones “modernizadoras” que sólo hundieron a los mexicanos…. “por el bien de México”, según repitieron como pericos. Y lo hicieron año tras año, durante 36, con resultados sociales devastadores.",Economía,https://www.jornada.com.mx/2024/09/28/opinion/016o1eco?partner=rss,28/09/2024
La Jornada,Retrasos del ferrocarril México-EU afectan el suministro agrícola,"Chicago. Los retrasos en el transporte ferroviario están perturbando el comercio de exportación entre Estados Unidos y México y obstaculizando las cadenas de suministro agrícola en plena cosecha de otoño boreal, denunciaron ayer organizaciones agrarias.",Economía,https://www.jornada.com.mx/2024/09/28/economia/016n1eco?partner=rss,28/09/2024
La Jornada,Pemex envía combustible de la Refinería Olmeca a India,"Petróleos Mexicanos (Pemex) envió este mes su primer cargamento de combustible de su nueva refinería Olmeca a India, una señal de progreso después de múltiples retrasos y costos en espiral, según datos de embarque y fuentes de la industria.",Economía,https://www.jornada.com.mx/2024/09/28/economia/015n2eco?partner=rss,28/09/2024
La Jornada,Déficit en finanzas públicas es menor a lo previsto: SHCP,"En los primeros ocho meses del año, el balance presupuestario observó un déficit de 897 mil 874 millones de pesos, monto que fue menor respecto a lo programado, mientras la deuda se mantuvo en un nivel sostenible, dijo la Secretaría de Hacienda y Crédito Público (SHCP).",Economía,https://www.jornada.com.mx/2024/09/28/economia/014n1eco?partner=rss,28/09/2024
La Jornada,Volkswagen negocia con sindicatos,"Después del explosivo anuncio de Volkswagen de que podría cerrar fábricas en Alemania por primera vez, la dirección de la empresa y los sindicatos iniciarán tensas conversaciones sobre un nuevo acuerdo salarial. La empresa ha subrayado repetidamente que sus costes son excesivos y sus márgenes de beneficio demasiado bajos, especialmente en su marca principal.",Economía,https://www.jornada.com.mx/2024/09/28/economia/016n3eco?partner=rss,28/09/2024
La Jornada,La BMV gana 1.1% en la semana; peso pierde 28 centavos,"El peso revirtió sus ganancias iniciales, un día después del impulso registrado por el anuncio del Banco de México de que recortó su tasa de interés.",Economía,https://www.jornada.com.mx/2024/09/28/economia/014n2eco?partner=rss,28/09/2024
La Jornada,Confirma Sheinbaum salida de Gabriel Yorio de la Subsecretaría de Hacienda,"El subsecretario de Hacienda, Gabriel Yorio González, no repetirá en el cargo durante el próximo sexenio, así lo confirmó la próxima titular del Ejecutivo federal.",Economía,https://www.jornada.com.mx/2024/09/28/economia/014n3eco?partner=rss,28/09/2024
La Jornada,El desempleo en Alemania aumenta más de lo previsto,"Berlín. El número de desempleados en Alemania aumentó más de lo previsto en septiembre, en una nueva señal de los retos a los que se enfrenta la mayor economía de Europa.",Economía,https://www.jornada.com.mx/2024/09/28/economia/016n2eco?partner=rss,28/09/2024
La Jornada,"Gustavo Gordillo / III: Justicia, anillos, poder","Para que haya mayorías, tiene que haber minorías. Son las minorías, su existencia política, las que constituyen un régimen de mayorías.",Economía,https://www.jornada.com.mx/2024/09/28/economia/015a1eco?partner=rss,28/09/2024
La Jornada,Desequilibrio en la balanza comercial acumuló 10 mil 438 mdd hasta agosto,"La balanza comercial del país observó en agosto de 2024 un déficit de 4 mil 868 millones de dólares, dinamismo que se explicó por el retroceso de uno por ciento en las exportaciones frente a igual periodo del año anterior, informó el Instituto Nacional de Estadística y Geografía (Inegi).",Economía,https://www.jornada.com.mx/2024/09/28/economia/015n1eco?partner=rss,28/09/2024
La Jornada,“Misión cumplida”,"“Misión cumplida”, dijo el artista Gabriel Orozco al cerrar un ciclo de casi seis años como coordinador del proyecto Chapultepec: Naturaleza y Cultura, el 24 de septiembre, cuando el presidente Andrés Manuel López Obrador inauguró la cuarta sección y última que faltaba por concluir de ese bosque urbano.",Cultura,https://www.jornada.com.mx/2024/09/28/cultura/a02n2cul?partner=rss,28/09/2024
La Jornada,Pablo Espinosa: Las creaturas que habitan Bellas Artes,La luz de las distintas horas los devora.,Cultura,https://www.jornada.com.mx/2024/09/28/cultura/a04a1cul?partner=rss,28/09/2024
La Jornada,Miguel Díaz Reynoso*: Cuadernos de La Habana,Encuentro en mis cuadernos varias referencias al asalto al Cuartel Moncada. Quizá deba empezar por los preparativos y cómo se decidió llevarlo a cabo ese 26 de julio.,Cultura,https://www.jornada.com.mx/2024/09/28/opinion/a03o1cul?partner=rss,28/09/2024
La Jornada,Chapultepec está listo para atender el presente y enfrentar el futuro: Orozco,"El Bosque de Chapultepec está listo para atender el presente y encarar el futuro, aseguró a La Jornada el artista veracruzano Gabriel Orozco, quien concluyó su labor de coordinador del proyecto Chapultepec: Naturaleza y Cultura, cuya cuarta sección, ya remodelada, se inauguró hace unos días.",Cultura,https://www.jornada.com.mx/2024/09/28/cultura/a02n1cul?partner=rss,28/09/2024
La Jornada,“La conclusión del proyecto Naturaleza y Cultura es una prioridad del gobierno entrante”,"El proyecto Chapultepec: Naturaleza y Cultura no se ha dado por concluido. Se mantendrá como prioritario para el próximo gobierno federal, afirmó la subsecretaria de Desarrollo Cultural de la Secretaría de Cultura federal (SC), Marina Núñez Bespalova.",Cultura,https://www.jornada.com.mx/2024/09/28/cultura/a03n1cul?partner=rss,28/09/2024
Expansión,El déficit fiscal de México crece 54% en agosto y supera el billón de pesos,La Secretaría de Hacienda y Crédito Público destacó que los Requerimientos Financieros del Sector Público sumaron 1.109 billones de pesos.,Economía,https://expansion.mx/economia/2024/09/27/deficit-fiscal-mexico-agosto,27/09/2024
Expansión,Gasolinas y diésel van por su primer mes sin subsidios,"Brindar menores estímulos ha permitido recaudar mayores ingresos a la secretaría de Hacienda; de enero a agosto de este año, ha recaudado 82% más dinero por IEPS a estos combustibles.",Economía,https://expansion.mx/economia/2024/09/27/gasolinas-y-diesel-van-por-su-primer-mes-sin-subsidios,27/09/2024
Expansión,"Inversiones en México se mantendrán, pese a débil Estado de Derecho: UBS","El banco de inversión dijo que México mantendrá sus inversiones, aunque sin aprovechar el potencial que ofrece el nearshoring.",Economía,https://expansion.mx/economia/2024/09/27/inversiones-en-mexico-se-mantendran-pese-a-debil-estado-de-derecho-ubs,27/09/2024
Expansión,"Yorio dejará su cargo como subsecretario de Hacienda, adelanta Bloomberg News",El funcionario dejará el puesto que ocupa en la Secretaría de Hacienda y Crédito Púbico desde 2019. La dependencia indicó a Expansión que no tiene información al respecto.,Economía,https://expansion.mx/economia/2024/09/27/el-subsecretario-de-hacienda-dejara-el-cargo-adelanta-bloomberg-news,27/09/2024
Expansión,El gasto de consumidores en EU aumenta en agosto; la inflación se desacelera,"El gasto de los consumidores sigue apoyándose en ganancias salariales aún sólidas, a pesar de que el mercado laboral se ha ralentizado considerablemente.",Economía,https://expansion.mx/economia/2024/09/27/gasto-consumidores-eu-aumenta-agosto-inflacion-desacelera,27/09/2024
Expansión,"México registra déficit comercial de 4,868 mdd en agosto","Las exportaciones mexicanos cayeron 1% y las importaciones crecieron 5.7%, de acuerdo con el Inegi.",Economía,https://expansion.mx/economia/2024/09/27/balanza-comercial-mexico-agosto-2024-inegi,27/09/2024
Expansión,Banxico mantendrá prudencia y cerrará el año con tasa en 10%,Los analistas consideran que el mensaje del banco central es más laxo que la decisión de agosto y esperan que haya dos recortes más de 25 puntos base.,Economía,https://expansion.mx/economia/2024/09/27/banxico-mantendra-prudencia-y-cerrara-el-ano-con-tasa-en-10,27/09/2024
Expansión,Banxico ejecuta nuevo recorte a la tasa a 10.5%,El banco central hizo un segundo recorte consecutivo a la tasa de referencia en un contexto de menor inflación.,Economía,https://expansion.mx/economia/2024/09/26/banxico-recorta-tasa-de-referencia-segunda-ocasion,26/09/2024
Expansión,Janet Yellen se opone a reducir requisitos de capital para bancos,La secretaria del Tesoro de Estados Unidos pidió seguir trabajando para que el sistema financiero sea resistente a los tiempos de turbulencias.,Economía,https://expansion.mx/economia/2024/09/26/yellen-se-opone-bajar-capital-bancos,26/09/2024
Expansión,Claudia Sheinbaum recibe una economía tocada por la incertidumbre,El paquete de 20 reformas que presentó AMLO en febrero de este año amenaza con limitar el crecimiento potencial de México.,Economía,https://expansion.mx/economia/2024/09/26/sheinbaum-recibe-economia-incertidumbre-reformas,26/09/2024
Expansión,Búsqueda de un segundo empleo se dispara en varias entidades; Morelos encabeza,"En México, dentro de la población subocupada, 328,971 personas están en condición de búsqueda de trabajo adicional, indican cifras del Inegi del segundo trimestre de 2024.",Economía,https://expansion.mx/economia/2024/09/26/busqueda-segundo-empleo-se-dispara-varias-entidades,26/09/2024
Expansión,Es poco probable que México pierda grado de inversión: Moody's,"La agencia señala que un mayor déficit fiscal, absorber deuda de Pemex y un bajo crecimiento sí pueden impactar su calidad crediticia.",Economía,https://expansion.mx/economia/2024/09/25/poco-probable-mexico-pierda-grado-inversion-moodys,25/09/2024
Expansión,Revolut planea operar en los primeros meses de 2025,"Juan Guerra, director general de la firma, dijo que espera arrancar operaciones el siguiente año con una cuenta de débito nivel 4 y transferencias internacionales.",Economía,https://expansion.mx/economia/2024/09/25/revolut-planea-operar-en-los-primeros-meses-de-2025,25/09/2024
Expansión,"Pemex requerirá 50,200 mdd en los tres primeros años de Sheinbaum, prevé Moody's","Sin el apoyo del gobierno la calificación real de Pemex sería una Ca, es decir con un 80% de incumplimiento de sus compromisos financieros.",Economía,https://expansion.mx/economia/2024/09/25/pemex-requerira-50-200-mdd-primeros-anos-sheinbaum-moodys,25/09/2024
Expansión,La Condusef alerta por suplantación de identidad de 24 financieras,Veinticuatro instituciones debidamente constituidas han reportado la suplantación de su identidad para cometer fraudes entre los usuarios.,Economía,https://expansion.mx/economia/2024/09/25/condusef-alerta-por-suplantacion-de-identidad-de-financieras,25/09/2024
Expansión,¿Abren los bancos el 1 de octubre? Esto dice el calendario de la CNBV,"El 1 de octubre, Claudia Sheinbaum toma posesión como la primera presidenta de México, esto implica un suceso de trascendencia nacional, por lo cual la mayoría de los empleados descansará.",Economía,https://expansion.mx/economia/2024/09/25/abren-bancos-1-octubre-2024-calendario-cnbv,25/09/2024
Expansión,Mercado Pago lo hace oficial: presentó solicitud para ser banco digital,La cuenta digital busca la aprobación de licencia bancaria ante la Comisión Nacional Bancaria y de Valores para ofrecer servicios de banca múltiple.,Economía,https://expansion.mx/economia/2024/09/25/mercado-pago-banco-mexico-permiso-cnbv,25/09/2024
Expansión,Banxico sólo tiene espacio para hacer recorte de 25 puntos,Los analistas consideran que el banco central debe tener cautela al bajar tasas en periodos de volatilidad y descartan que hagan un recorte de 50 puntos como lo hizo la Reserva Federal.,Economía,https://expansion.mx/economia/2024/09/25/por-que-banxico-no-puede-hacer-recortes-50-puntos-tasa,25/09/2024
Expansión,La OCDE ajusta a la baja su previsión del PIB para México,"De acuerdo con el organismo, la economía mexicana crecerá 1.4% este año, 0.8% menos que en la previsión anterior.",Economía,https://expansion.mx/economia/2024/09/25/ocde-crecimiento-pib-mexico-2024-1-4,25/09/2024
Expansión,BBVA mantiene su confianza en México ante la transición presidencial,"El país sigue siendo atractivo a largo plazo gracias a su estructura de costos y apalancamiento en comparación con Estados Unidos, dijo Onur Genç, consejero delegado de BBVA.",Economía,https://expansion.mx/economia/2024/09/25/bbva-mantiene-su-confianza-en-mexico-ante-la-transicion-presidencial,25/09/2024
Expansión,China recorta otra tasa de interés para impulsar la economía,"El interés de los préstamos a un año concedidos a las instituciones financieras se redujo del 2.3 al 2%, informó el banco central.",Economía,https://expansion.mx/economia/2024/09/25/china-recorta-otra-tasa-de-interes-para-impulsar-la-economia,25/09/2024
Expansión,La austeridad selectiva predominó en el gobierno de AMLO,"Más que recortes a gastos onerosos o generar ahorros, el gasto público llegó a niveles récord, obedeciendo a prioridades y obligaciones del gobierno a cargo de Andrés Manuel López Obrador.",Economía,https://expansion.mx/economia/2024/09/25/austeridad-gobierno-amlo,25/09/2024
Expansión,Mexicanos gastan 12% más en bebidas energéticas,Datos de Kantar muestran que en los últimos años ha aumentado tanto el número de litros comprados como el precio de este tipo de bebidas.,Economía,https://expansion.mx/economia/2024/09/24/mexicanos-gastan-12-mas-en-bebidas-energeticas,24/09/2024
Expansión,Trump amaga con arancel de 100% a autos que entren por la frontera con México,El candidato presidencial dijo que la única manera de que se libren de esa cuota es si quieren construir una planta en Estados Unidos.,Economía,https://expansion.mx/economia/2024/09/24/trump-amaga-arancel-100-autos-entren-frontera-mexico,24/09/2024
Expansión,"Cetes a dos años reducen rendimientos a un dígito, anticipa recorte de Banxico","Todos los plazos de los Cetes redujeron sus ganancias, pero el plazo de dos años ofrece la tasa más baja de 9.92%, a la espera de que Banxico haga un nuevo recorte.",Economía,https://expansion.mx/economia/2024/09/24/cetes-a-dos-anos-reducen-rendimientos-a-un-digito-anticipa-recorte-de-banxico,24/09/2024
Expansión,Openbank lanza su lista de espera para clientes mexicanos,Openbank México abre en su sitio web la lista de espera para aquellos usuarios que quieran acceder a la oferta de este nuevo banco digital.,Economía,https://expansion.mx/economia/2024/09/24/openbank-lanza-lista-de-espera-para-clientes-mexicanos,24/09/2024
Expansión,"Banco Mundial logra récord de 56,000 mdd en inversiones CFI","Para el ejercicio financiero que finalizará en julio de 2025, el Banco Mundial buscará centrar sus esfuerzos en infraestructura, particularmente en carreteras y transporte.",Economía,https://expansion.mx/economia/2024/09/24/banco-mundial-creditos-cfi-record-56-000-mdd,24/09/2024
Expansión,China presenta medidas de relajación monetaria para reactivar la economía,"El Banco Popular de China recortará el tipo de interés de las operaciones dobles a siete días en 0.2 puntos porcentuales, hasta el 1.5%.",Economía,https://expansion.mx/economia/2024/09/24/china-presenta-medidas-reactivacion-de-economia,24/09/2024
Expansión,"Inflación sigue a la baja, en la primera mitad de septiembre se ubicó en 4.66%","El índice subyacente terminó la primera quincena de septiembre en 3.95% y el no subyacente en 6.73%, de acuerdo con datos publicados por el Inegi.",Economía,https://expansion.mx/economia/2024/09/24/inflacion-en-mexico-sigue-a-la-baja-inpc-septiembre,24/09/2024
Expansión,"Fomentar vivienda de interés social y eliminar corrupción, retos del Infonavit","Analistas señalan que el instituto tiene pendientes en materia de avanzar en la digitalización y la agilización de trámites, así como en mejorar los rendimientos en la subcuenta de vivienda.",Economía,https://expansion.mx/economia/2024/09/24/pendientes-logros-infonavit,24/09/2024
Expansión,Denuncian a Visa por monopolio en Estados Unidos,"El Departamento de Justicia de Estados Unidos busca denunciar a la empresa  por monopolio en el mercado de tarjetas de débito, de acuerdo con un reporte de Blomberg.",Economía,https://expansion.mx/economia/2024/09/23/denuncian-a-visa-por-monopolio-en-estados-unidos,24/09/2024
Expansión,Empresas de EU reactivarán anuncios de inversión; confían en Sheinbaum,"Tras detener un anuncio importante de inversión por la reforma judicial, la American Society of Mexico informó que en próximas fechas se retomará, pero con cautela.",Economía,https://expansion.mx/economia/2024/09/23/empresas-de-eu-reactivaran-anuncios-de-inversion-confian-en-sheinbaum,23/09/2024
Expansión,El endeudamiento de mexicanos en el exterior representa 35% del PIB,El Banco de México (Banxico) dio a conocer que en el segundo trimestre del año se redujo el endeudamiento del mundo desde el 42% reportado en el primer trimestre.,Economía,https://expansion.mx/economia/2024/09/23/deuda-de-mexicanos-en-el-exterior-representa-35-del-pib,23/09/2024
Expansión,Las auditorías dan ingresos por 3.5 billones de pesos al SAT,"De estos recursos, 1.426 billones de pesos se obtuvieron por auditorías a grandes contribuyentes, informa el fisco.",Economía,https://expansion.mx/economia/2024/09/23/auditorias-dan-al-sat-ingresos-por-3-5-billones-de-pesos,23/09/2024
Expansión,Economía mexicana crece 0.6% en julio,Las actividades primarias encabezaron el crecimiento económico del país durante el séptimo mes del año.,Economía,https://expansion.mx/economia/2024/09/23/economia-mexicana-crece-tercer-mes-consecutivo,23/09/2024
Expansión,Una jubilación digna se complica cada vez más para los mexicanos,"Una quinta parte de los empleados en el país contempla jubilarse a los 66 años o más, mientras que otro 86% admite ahorrar menos de lo que debería hacerlo en la actualidad.",Economía,https://expansion.mx/economia/2024/09/23/jubilacion-digna-se-complica-para-los-mexicanos,23/09/2024
Expansión,El plan de sustituir importaciones de Asia con el nearshoring se torna difícil,"En los primeros siete meses del año, las importaciones de México desde Asia alcanzaron los 141,219 millones de dólares; China representa 51% del total.",Economía,https://expansion.mx/economia/2024/09/23/plan-sustituir-importaciones-asia-nearshoring-dificil,23/09/2024
Expansión,Carlos Slim critica el sistema de pensiones en México y pide combatir la pobreza,El hombre más rico de México dice que los recursos que reciben actualmente los mayores de 65 años debería usarse para sacar a 6 millones de personas de la pobreza extrema.,Economía,https://expansion.mx/economia/2024/09/22/carlos-slim-critica-pensiones,22/09/2024
Expansión,"Anuncios de inversión en México suman 59,900 mdd en primeros nueve meses de 2024",La Secretaría de Economía identifica 197 anuncios públicos entre enero y septiembre. Estados Unidos encabeza los anuncios.,Economía,https://expansion.mx/economia/2024/09/22/anuncios-de-inversion-en-mexico-suman-59-900-mdd-en-primeros-nueve-meses-de-2024,22/09/2024
Expansión,China sufre por exceso... de leche,"El mercado de leche en China enfrenta una situación complicada por el exceso de oferta, la baja demanda y las pérdidas millonarias.",Economía,https://expansion.mx/economia/2024/09/20/china-sufre-por-exceso-de-leche,20/09/2024
Expansión,"EU pide ""implementación rigurosa"" de plan de certificación de aguacate de México","Las ventas de aguacate mexicano a Estados Unidos se han disparado 48% desde 2019, hasta alcanzar un valor de más de 3,000 millones de dólares el año pasado.",Economía,https://expansion.mx/economia/2024/09/20/eu-implementacion-rigurosa-certificacion-aguacate-mexico,20/09/2024
Expansión,Banqueros piden evitar arbitraje regulatorio con licencias bancarias,El presidente de la ABM dijo que los productos que ofrece cada una de las instituciones financieras deben tener una regulación igual para mantener el incentivo de inversión en el país.,Economía,https://expansion.mx/economia/2024/09/20/banqueros-evitar-arbitraje-regulatorio-licencias-bancarias,20/09/2024
Expansión,Banqueros esperan que leyes secundarias de reforma judicial den certidumbre,"Tras la aprobación de la reforma al Poder Judicial,  los banqueros esperan que en las leyes secundarias se afinen detalles que permitan una reforma ""exitosa"".",Economía,https://expansion.mx/economia/2024/09/20/banqueros-leyes-secundarias-certidumbre-reforma-judicial,20/09/2024
Expansión,Eliminación de subsidios a gasolinas impedirá bajas en sus precios,"La medida de disminución de los estímulos fiscales obedece más a la necesidad de incrementar la recaudación de impuestos para reducir el déficit fiscal, consideran especialistas.",Economía,https://expansion.mx/economia/2024/09/20/por-que-no-baja-el-precio-de-la-gasolina-en-mexico,20/09/2024
Expansión,México impugnará fallo que determina pago de 37 mdd a Odyssey Marine Exploration,"La empresa estadounidense ganó un arbitraje internacional contra México, pues se consideró que Semarnat negó arbitrariamente un permiso para un proyecto minero marino en Baja California Sur.",Economía,https://expansion.mx/economia/2024/09/19/mexico-impugnara-fallo-pago-de-37-mdd-odyssey-marine,20/09/2024
Expansión,El 24% de los créditos hipotecarios es cofinanciado con Infonavit y Fovissste,"La Asociación de Bancos de México dijo que de enero a julio de este año, 16,100 créditos que ha dado la banca han tenido cofinanciamiento con los institutos para trabajadores.",Economía,https://expansion.mx/economia/2024/09/19/creditos-hipotecarios-cofinanciados-infonavit-fovissste,19/09/2024
