Source,Title,Content,Section,URL,Date
La Jornada,"In extremis, las Águilas rescatan  valioso empate 1-1 ante el Necaxa","Con un gol agónico de Henry Martín, el América rescató un valioso empate 1-1 ante el Necaxa, con lo que hilvanó tres partidos sin conocer la derrota, ayer en due-lo correspondiente a la jornada nueve del torneo Apertura 2024 de la Liga Mx, disputado en el estadio Victoria, en Aguascalientes.",Deporte,https://www.jornada.com.mx/2024/09/22/deportes/a09n1dep?partner=rss,22/09/2024
La Jornada,Dubois noquea a Joshua y retiene cetro de los pesados,"Londres. Daniel Dubois retuvo el título de los pesados de la Federación Internacional de Boxeo (FIB) al noquear en el quinto asalto al ex bicampeón Anthony Joshua, en la primera defensa de su cinturón realizada en el estadio de Wembley",Deporte,https://www.jornada.com.mx/2024/09/22/deportes/a11n2dep?partner=rss,22/09/2024
La Jornada,Copa Laver,"El equipo del resto del mundo tomó ventaja de 8-4 en la Copa Laver sobre la selección de Europa. Los triunfos de los estadunidenses Taylor Fritz (en la imagen) y Frances Tiafoe contra el alemán Alexander Zverev y el ruso Daniil Medvedev, respectivamente, fueron fundamentales para que los comandados por John McEnroe tomaran la delantera en la justa que define hoy al campeón que acumule 13 puntos en Berlín.",Deporte,https://www.jornada.com.mx/2024/09/22/deportes/a10n3dep?partner=rss,22/09/2024
La Jornada,"Cruz Azul, intratable; vence 1-0 a Chivas y afianza superliderato","Hay partidos que marcan la agenda de Cruz Azul. Después del clásico joven con el América, la rivalidad contra el Guadalajara tiene un valor especial. Con ese peso de un escenario importante, La Máquina volvió a cantar victoria en el estadio Ciudad de los Deportes (1-0) para mantenerse como único líder en la Liga Mx y seguir en carrera por el campeonato.",Deporte,https://www.jornada.com.mx/2024/09/22/deportes/a27n2dep?partner=rss,22/09/2024
La Jornada,Gobierno de la CDMX premia a más de un millar de atletas locales,Más de un millar de atletas capitalinos fueron premiados ayer por su participación en los Juegos Nacionales Conade.,Deporte,https://www.jornada.com.mx/2024/09/22/deportes/a11n1dep?partner=rss,22/09/2024
La Jornada,Leyendas del pancracio regresan a la Coliseo en el Día nacional del luchador,"Un hombre, en otras ocasiones una mujer, con una máscara sube al ring de la arena Coliseo, la afición lo ovaciona, no importa si es rudo o técnico, todos saben que está en ese cuadrilátero para arriesgar la vida en medio de uno de los espectáculos más vistosos, folclóricos y polémicos del deporte: la lucha libre. Místico, Octagón y Atlantis, leyendas de esta disciplina, fueron ayer representantes históricos en una función con motivo del Día nacional del luchador y la lucha libre.",Deporte,https://www.jornada.com.mx/2024/09/22/deportes/a27n1dep?partner=rss,22/09/2024
La Jornada,"Jiménez, en plan goleador; brilla en triunfo del Fulham","Raúl Jiménez anotó de nuevo con el Fulham en la Liga Premier inglesa. El delantero mexicano, de 33 años, abrió el marcador en Craven Cottage ante el Newcastle United y encaminó la victoria por 3-1 en la quinta fecha.",Deporte,https://www.jornada.com.mx/2024/09/22/deportes/a10n1dep?partner=rss,22/09/2024
La Jornada,"Norris consigue la pole  en el GP de Singapur; Checo, fuera del top-10","El mexicano Sergio Pérez (Red Bull) entró en un socavón. Arrancó des-de el fondo, esperanzado que sus neumáticos le ayudarían a remontar, pero terminó lejos de los dos pilotos que disputan el título mundial de la Fórmula 1 en la calificación al Gran Premio de Singapur. Ubicado en el lugar 13, el tapatío finalizó otra carrera poco memorable respecto del rendimiento de Lando Norris (McLaren) y el tricampeón mundial Max Verstappen, primero y segundo en la parrilla de salida, respectivamente.",Deporte,https://www.jornada.com.mx/2024/09/22/deportes/a10n2dep?partner=rss,22/09/2024
La Jornada,"Manuel Ahumada, un dibujante “demasiado viejo para el punk, pero muy joven para morir”","Era “demasiado viejo para el punk, pero muy joven para morir”, dijo de Manuel Ahumada (1956-2014) Gonzalo Rocha, ambos moneros y colaboradores de La Jornada. “Un día se elevó de más y ahora nos mira desde el cosmos, acompañado por dioses aztecas, ángeles y astronautas del Apolo 11”, agregó en referencia al día que aquél falleció y a esos personajes que eran frecuentes en su imaginario y su obra.",Cultura,https://www.jornada.com.mx/2024/09/22/cultura/a05n1cul?partner=rss,22/09/2024
La Jornada,Elena Poniatowska: El Grito,"En la madrugada del 16 de septiembre del 1810, el “Grito de Independencia”, que según la historia dio el cura Miguel Hidalgo y Costilla en el pueblo de Dolores, Guanajuato, rasgó el cielo e hizo que estallara el movimiento de Independencia.",Cultura,https://www.jornada.com.mx/2024/09/22/cultura/a04a1cul?partner=rss,22/09/2024
La Jornada,Brasil! Brasil! revela una visión vibrante del Modernismo,"Berna. La exposición Brasil! Brasil!: The Birth of Modernism (¡Brasil! ¡Brasil!: El nacimiento del Modernismo0, inaugurada en el Zentrum Paul Klee, ofrece una visión vibrante de ese movimiento artístico en el país sudamericano a lo largo de la obra de 10 artistas, cinco de ellos autodidactas y poco conocidos internacionalmente. Varias de las 130 obras expuestas han salido de Brasil por primera vez. La muestra coincide temáticamente con la Bienal de Venecia, donde más de la mitad de los artistas aquí presentes también participan.",Cultura,https://www.jornada.com.mx/2024/09/22/cultura/a02n1cul?partner=rss,22/09/2024
La Jornada,Secretario de Arte y Cultura de Morena rinde su informe de actividades,"El Secretario de Arte y Cultura del Comité Ejecutivo Nacional (CEN) de Morena, Tomás Pliego Calvo, indicó que por medio de la participación de las 22 comisiones estatales de arte y cultura, artistas, creadores, promotores, gestores culturales, colectivos y cooperativas, organizados a partir del plan de acción de la secretaría, “realizaron tareas y actividades en defensa de la Cuarta Transformación (4T), promoviendo una cultura incluyente y equitativa que luchó y lucha contra el clasismo, el racismo, el machismo y el fascismo”.",Cultura,https://www.jornada.com.mx/2024/09/22/cultura/a03n2cul?partner=rss,22/09/2024
La Jornada,Entusiastas asistentes y la OSM festejaron en las Islas de CU 114 años de la UNAM,"El rugido puma resonó a todo volumen este sábado en las Islas de Ciudad Universitaria (CU), donde la Universidad Nacional Autónoma de México (UNAM) celebró su 114 aniversario con un concierto memorable a cargo de la Orquesta Sinfónica de Minería (OSM).",Cultura,https://www.jornada.com.mx/2024/09/22/cultura/a03n1cul?partner=rss,22/09/2024
La Jornada,Para tomar en cuenta,"En la semana que inicia se darán a conocer diversos reportes, como inflación, ventas al menudeo, indicador de actividad económica, balanza comercial y anuncio de política monetaria, entre otros.",Economia,https://www.jornada.com.mx/2024/09/22/economia/015n3eco?partner=rss,22/09/2024
La Jornada,Impulsa la CRE infraestructura para autos eléctricos,"Las disposiciones administrativas en materia de electromovilidad emitidas por la Comisión Reguladora de Energía (CRE) no sólo impulsarán el desarrollo de la infraestructura para el uso de automóviles eléctricos e híbridos, sino también el ordenamiento en el Sistema Eléctrico Nacional (SEN), de acuerdo con el propio regulador.",Economia,https://www.jornada.com.mx/2024/09/22/economia/015n2eco?partner=rss,22/09/2024
La Jornada,"Joseph E. Stiglitz, Kevin P. Gallagher, Martín Guzmán y Marilou Uy Especial para La Jornada: El FMI debe poner fin a sus destructivos recargos",,Economia,https://www.jornada.com.mx/2024/09/22/economia/014a1eco?partner=rss,22/09/2024
La Jornada,EU prohibirá software y hardware chinos en vehículos,"Washington. El Departamento de Comercio de Estados Unidos propondría el lunes prohibir el software y hardware chinos en los vehículos conectados y autónomos en las carreteras del país debido a preocupaciones de seguridad nacional, dijeron fuentes a Reuters.",Economia,https://www.jornada.com.mx/2024/09/22/economia/014n1eco?partner=rss,22/09/2024
La Jornada,Cifras verdes,"* Como llave de los programas de planeación de ciudades inteligentes y verdes, la bicicleta ha recuperado relevancia en los proyectos urbanos.",Economia,https://www.jornada.com.mx/2024/09/22/economia/013n2eco?partner=rss,22/09/2024
La Jornada,Tribunal da 5 días a X para validar a su representante legal en Brasil,"Río de Janeiro., La red social X nombró un representante legal en Brasil, una de las exigencias para volver a funcionar en el país, pero seguirá suspendida hasta cumplir otros requisitos judiciales. El Tribunal Supremo de Brasil dio a la plataforma social X, propiedad de Elon Musk, cinco días para presentar documentos que validen a su nuevo representante legal en el país, mostró el sábado una decisión judicial.",Economia,https://www.jornada.com.mx/2024/09/22/economia/014n2eco?partner=rss,22/09/2024
La Jornada,"Seguridad energética, amenazada a nivel mundial por tensiones geopolíticas: WEF","La transición energética a nivel global observa avances, en particular en las economías desarrolladas, así como China y Brasil. No obstante, la equidad ha retrocedido y las tensiones geopolíticas causan incertidumbre en la seguridad energética, revela un informe del Foro Económico Mundial (WEF, por sus siglas en inglés).",Economia,https://www.jornada.com.mx/2024/09/22/economia/015n1eco?partner=rss,22/09/2024
La Jornada,El imperio de la bicicleta recupera terreno en Pekín,"Pekín. Un recién llegado a Pekín puede tener cierta paranoia, confundida con certeza, de que será atropellado. Más temprano que tarde un auto, bicicleta, motocicleta o triciclo podría darle un empujón y dejarle a un costado de la acera sobándose los raspones entre la risa y el asombro, buscando curitas en una tienda de conveniencia.",Economia,https://www.jornada.com.mx/2024/09/22/economia/013n1eco?partner=rss,22/09/2024
Expansión,Carlos Slim critica el sistema de pensiones en México y pide combatir la pobreza,El hombre más rico de México dice que los recursos que reciben actualmente los mayores de 65 años debería usarse para sacar a 6 millones de personas de la pobreza extrema.,Economia,https://expansion.mx/economia/2024/09/22/carlos-slim-critica-pensiones,22/09/2024
Expansión,"Anuncios de inversión en México suman 59,900 mdd en primeros nueve meses de 2024",La Secretaría de Economía identifica 197 anuncios públicos entre enero y septiembre. Estados Unidos encabeza los anuncios.,Economia,https://expansion.mx/economia/2024/09/22/anuncios-de-inversion-en-mexico-suman-59-900-mdd-en-primeros-nueve-meses-de-2024,22/09/2024
Expansión,China sufre por exceso... de leche,"El mercado de leche en China enfrenta una situación complicada por el exceso de oferta, la baja demanda y las pérdidas millonarias.",Economia,https://expansion.mx/economia/2024/09/20/china-sufre-por-exceso-de-leche,20/09/2024
Expansión,"EU pide ""implementación rigurosa"" de plan de certificación de aguacate de México","Las ventas de aguacate mexicano a Estados Unidos se han disparado 48% desde 2019, hasta alcanzar un valor de más de 3,000 millones de dólares el año pasado.",Economia,https://expansion.mx/economia/2024/09/20/eu-implementacion-rigurosa-certificacion-aguacate-mexico,20/09/2024
Expansión,Banqueros piden evitar arbitraje regulatorio con licencias bancarias,El presidente de la ABM dijo que los productos que ofrece cada una de las instituciones financieras deben tener una regulación igual para mantener el incentivo de inversión en el país.,Economia,https://expansion.mx/economia/2024/09/20/banqueros-evitar-arbitraje-regulatorio-licencias-bancarias,20/09/2024
Expansión,Banqueros esperan que leyes secundarias de reforma judicial den certidumbre,"Tras la aprobación de la reforma al Poder Judicial,  los banqueros esperan que en las leyes secundarias se afinen detalles que permitan una reforma ""exitosa"".",Economia,https://expansion.mx/economia/2024/09/20/banqueros-leyes-secundarias-certidumbre-reforma-judicial,20/09/2024
Expansión,Eliminación de subsidios a gasolinas impedirá bajas en sus precios,"La medida de disminución de los estímulos fiscales obedece más a la necesidad de incrementar la recaudación de impuestos para reducir el déficit fiscal, consideran especialistas.",Economia,https://expansion.mx/economia/2024/09/20/por-que-no-baja-el-precio-de-la-gasolina-en-mexico,20/09/2024
Expansión,México impugnará fallo que determina pago de 37 mdd a Odyssey Marine Exploration,"La empresa estadounidense ganó un arbitraje internacional contra México, pues se consideró que Semarnat negó arbitrariamente un permiso para un proyecto minero marino en Baja California Sur.",Economia,https://expansion.mx/economia/2024/09/19/mexico-impugnara-fallo-pago-de-37-mdd-odyssey-marine,20/09/2024
Expansión,El 24% de los créditos hipotecarios es cofinanciado con Infonavit y Fovissste,"La Asociación de Bancos de México dijo que de enero a julio de este año, 16,100 créditos que ha dado la banca han tenido cofinanciamiento con los institutos para trabajadores.",Economia,https://expansion.mx/economia/2024/09/19/creditos-hipotecarios-cofinanciados-infonavit-fovissste,19/09/2024
Expansión,"Yellen considera ""señal muy positiva"" recorte de tasas de la Fed","La medida ""refleja confianza de parte de la Fed en que la inflación cedió y está en camino hacia la meta de 2% (anual)"", expresó la secretaria del Tesoro de EU.",Economia,https://expansion.mx/economia/2024/09/19/yellen-considera-senal-muy-positiva-recorte-de-tasas-de-fed,19/09/2024
Expansión,La CNBV buscará regular reportes de ciberseguridad,El regulador busca que todas las empresas que ofrezcan un servicio financiero deban homologar los criterios para reportar cuando han sido víctimas de un ataque cibernético.,Economia,https://expansion.mx/economia/2024/09/19/la-cnbv-buscara-regular-reportes-de-ciberseguridad,19/09/2024
Expansión,Recorte de la Fed da margen de maniobra a Banco de México,"Tras la decisión de política monetaria del banco central estadounidense, Banxico tiene oportunidad de mantener el amplio diferencial de tasas, aseguran analistas.",Economia,https://expansion.mx/economia/2024/09/19/recorte-fed-margen-maniobra-banxico-politica-monetaria,19/09/2024
Expansión,Claudia Sheinbaum se reunirá con empresarios de Estados Unidos en octubre,"En medio de voces empresariales que dicen que las inversiones se han detenido por la reforma judicial, Marcelo Ebrard anunció la asistencia de la próxima presidenta de México en el CEO Dialogue.",Economia,https://expansion.mx/economia/2024/09/18/ebrard-anuncia-sheinbaum-reunion-empresas-de-eu,18/09/2024
Expansión,¿Dónde hay mayor brecha salarial por género en México?,"Banxico realizó un análisis de las brechas salariales de género en las regiones de México, los resultados demuestran que el norte es donde hay mayor diferencia de remuneración entre hombres y mujeres.",Economia,https://expansion.mx/economia/2024/09/18/brecha-salarial-por-genero-en-mexico,18/09/2024
Expansión,¿Por qué es importante tener un seguro para tu negocio?,"Un seguro no solo cubre los daños materiales, sino que también puede asegurar la continuidad de las operaciones en caso de un siniestro, destaca la AMIS.",Economia,https://expansion.mx/economia/2024/09/18/por-que-es-importante-tener-un-seguro-para-tu-negocio,18/09/2024
Expansión,Peligra economía de México si Trump gana y cumple con aranceles: Moody's,La agencia calificadora anticipa que la economía mexicana sufriría una recesión en 2025 y una mayor inflación.,Economia,https://expansion.mx/economia/2024/09/18/economia-de-mexico-peligra-recesion-si-gana-trump,18/09/2024
Expansión,"RappiCard alcanza los 5,107 millones de pesos en su cartera de crédito",La empresa resalta que parte de su estrategia es ofrecer un proceso de solicitud y aprobación en solo dos minutos y una entrega de la tarjeta física en 30 minutos.,Economia,https://expansion.mx/economia/2024/09/18/rappicard-alcanza-5107-mdp-cartera-de-credito,18/09/2024
Expansión,"Fed baja tasas medio punto porcentual; aduce ""confianza"" en control de inflación",Los responsables de la política monetaria prevén que el tipo de referencia de la Reserva Federal caiga otro medio punto porcentual a finales de este año.,Economia,https://expansion.mx/economia/2024/09/18/fed-baja-tasas-medio-punto-porcentual-aduce-confianza-en-control-de-inflacion,18/09/2024
Expansión,Mercado Pago recibe financiamiento de JP Morgan para apoyar a Pymes mexicanas,La plataforma logra un acuerdo con el banco de inversión de 250 millones de dólares para apoyar a pequeños negocios en el país.,Economia,https://expansion.mx/economia/2024/09/18/mercado-pago-recibe-financiamiento-de-jp-morgan,18/09/2024
Expansión,El número de súper ricos se dispara en Estados Unidos y China,La población China con al menos 100 millones de dólares en sus cuentas se ha duplicado en los últimos 10 años.,Economia,https://expansion.mx/economia/2024/09/18/paises-con-mas-super-ricos,18/09/2024
Expansión,Infonavit maneja 2.4 billones de pesos en activos: Carlos Martínez,"Los fondos del instituto han aumentado por los aumentos salariales, las mayores aportaciones patronales, la fiscalización a empresas, los programas de regularización de créditos.",Economia,https://expansion.mx/economia/2024/09/18/cuanto-dinero-maneja-el-infonavit,18/09/2024
Expansión,El impacto del nearshoring y las tendencias laborales según MetLife México,"La escasez de talento calificado, la importancia de beneficios competitivos y la necesidad de una cultura organizacional sólida son los principales desafíos a los que se enfrentan las empresas",Economia,https://expansion.mx/economia/2024/09/18/el-impacto-nearshoring-mexico-tendencias-laborales-metlife,18/09/2024
Expansión,"Sofipos ven oportunidades en su figura, a pesar de la migración bancaria","La Asociación Mexicana de Sofipos (AMS) considera que con una nueva regulación, las instituciones pueden seguir creciendo con ayuda de la regulación y la tecnología.",Economia,https://expansion.mx/economia/2024/09/18/sofipos-ven-oportunidades-en-su-figura-a-pesar-de-la-migracion-bancaria,18/09/2024
Expansión,Las Afores registran ganancias en agosto; las más altas en 9 meses,"Las Afores registraron plusvalías de 231,284.6 millones de pesos en agosto, el monto más alto desde noviembre del año pasado.",Economia,https://expansion.mx/economia/2024/09/17/afores-plusvalias-record-2024,18/09/2024
Expansión,Estos son las mercancías que más importa México desde el exterior,"Los países a los que más le compra México son Estados Unidos, que representa casi 43% del total de las importaciones, seguido por China, con 20% y Japón, con 3%.",Economia,https://expansion.mx/economia/2024/09/17/estos-son-las-mercancias-que-mas-importa-mexico-desde-el-exterior,17/09/2024
Expansión,"El SAT obtiene 191,506 mdp por eficiencia recaudatoria en 2024","La mayor eficiencia recaudatoria se debe principalmente a los programas Cumplimiento de Obligaciones, Vigilancia Profunda y Cobranza Coactiva.",Economia,https://expansion.mx/economia/2024/09/17/sat-obtiene-191-506-mdp-por-eficiencia-recaudatoria,17/09/2024
Expansión,Los Cetes reducen rendimiento previo a decisión de Banxico,"La próxima semana, el Banco de México (Banxico) dará a conocer su decisión de política monetaria y los Cetes disminuyeron los rendimientos en todos los plazos.",Economia,https://expansion.mx/economia/2024/09/17/rendimientos-cetes-disminuyen,17/09/2024
Expansión,El gobierno de Sheinbaum necesitará una nueva política para atraer inversiones,"Consumada la desaparición de ProMéxico, los esfuerzos por atraer inversión extranjera se dividieron. Los especialistas cuestionan si con un ente líder podría lograrse aún más.",Economia,https://expansion.mx/economia/2024/09/17/sheinbaum-y-nearshoring-fortalecer-inversion-extranjera,17/09/2024
Expansión,México y EU acuerdan que Sader supervise el aguacate para exportación,Los gobiernos de México y Estados Unidos acordaron esta transferencia de responsabilidades para agilizar el comercio.,Economia,https://expansion.mx/economia/2024/09/16/mexico-y-eu-acuerdan-que-sader-supervise-el-aguacate-para-exportacion,16/09/2024
Expansión,No todo es T-MEC; estos son los tratados comerciales que aguardan a Ebrard,"México tiene el potencial de ampliar y diversificar sus exportaciones, al menos en cinco tratados, además del que tiene con Estados Unidos y Canadá.",Economia,https://expansion.mx/economia/2024/09/16/no-todo-t-mec-otros-tratados-aguardan-marcelo-ebrard,16/09/2024
Expansión,"Instituciones de crédito en incertidumbre por la Reforma Judicial, dice Moody’s",Las pequeñas y medianas empresas enfrentarán una desaceleración en los créditos dada la falta de certeza jurídica para las instituciones financieras no bancarias.,Economia,https://expansion.mx/economia/2024/09/14/instituciones-credito-incertidumbre-reforma-judicial-moodys,14/09/2024
Expansión,Las sequías impactan el precio y peso de la carne de res: Banxico,El Banco de México destacó que las sequías provocan que los productores de carne sacrifiquen al ganado antes de tiempo para que no pierdan peso; lo que llega a provocar inflación en el mediano plazo.,Economia,https://expansion.mx/economia/2024/09/13/banxico-advierte-impacto-sequias-carne-de-res,13/09/2024
Expansión,HR Ratings baja previsión de crecimiento a 1.4% para México en 2024,"La agencia calificadora ve un ambiente de incertidumbre por el cambio de administración y las reformas de AMLO, por lo que también recortó su pronóstico para 2025.",Economia,https://expansion.mx/economia/2024/09/13/hr-ratings-baja-prevision-crecimiento-a-1-4-para-mexico,13/09/2024
Expansión,Gasolina Magna va por su segunda semana sin subsidios,"Durante la semana del 14 al 20 de septiembre, los consumidores pagarán 6.1752 pesos por el Impuesto Especial sobre Producción y Servicios (IEPS) por litro de gasolina regular.",Economia,https://expansion.mx/economia/2024/09/13/hacienda-quita-subsidio-gasolina-magna-segunda-semana,13/09/2024
Expansión,Banxico proyecta apogeo del nearshoring en México entre 2026 y 2030,"En una encuesta de Banco de México, el 41.3% de las empresas consultadas estima que el mayor beneficio del proceso de relocalización se dará durante ese periodo.",Economia,https://expansion.mx/economia/2024/09/13/banxico-proyecta-apogeo-del-nearshoring-en-mexico-entre-2026-y-2030,13/09/2024
Expansión,Fitch y S&P descartan degradar calificación de México por reforma judicial,Las agencias calificadoras ven finanzas sólidas y esperan una prudencia fiscal con Claudia Sheinbaum.,Economia,https://expansion.mx/economia/2024/09/12/descartan-degradar-calificacion-mexico-reforma-judicial,13/09/2024
Expansión,"Él es Antonio Martínez Dagnino, jefe del SAT en el gobierno de Sheinbaum","Antonio Martínez Dagnino llegó a la jefatura del SAT en octubre del 2022, luego de que Raquel Buenrostro pasara a tomar el liderazgo en la Secretaría de Economía.",Economia,https://expansion.mx/economia/2024/09/12/quien-es-antonio-martinez-dagnino,12/09/2024
Expansión,"De Pemex a Infonavit, él es Octavio Romero Oropeza","La presidenta electa, Claudia Sheinbaum, dio a conocer que Romero Oropeza estará al frente del Instituto del Fondo Nacional de la Vivienda para los Trabajadores.",Economia,https://expansion.mx/economia/2024/09/12/octavio-romero-oropeza-infonavit-pemex-claudia-sheinbaum,12/09/2024
Expansión,BBVA advierte que reforma al Poder Judicial socava el Estado de derecho,Un análisis del banco considera que las perspectivas de crecimiento económico de México también pueden deteriorarse.,Economia,https://expansion.mx/economia/2024/09/12/bbva-advertencia-reforma-poder-judicial,12/09/2024
Expansión,El papel de la economía del bienestar en los gobiernos modernos,"La economía del bienestar prioriza la salud y la felicidad de las personas, colocando estos valores al mismo nivel, o incluso por encima, de los indicadores económicos tradicionales como el PIB.",Economia,https://expansion.mx/economia/2024/09/12/el-papel-de-la-economia-del-bienestar-en-los-gobiernos-modernos,12/09/2024
Expansión,"Los salarios, programas sociales y remesas mantienen el consumo en México","Pese a la inflación y mayor tasa de interés, el consumo privado en México ha sido un pilar para la economía, pero a esta tendencia le queda poco tiempo, advierten analistas.",Economia,https://expansion.mx/economia/2024/09/12/inflacion-y-tasas-de-interes-consumo-en-mexico-se-mantiene,12/09/2024
Expansión,Moody's prevé que reforma judicial debilite la calidad crediticia de México,"Los cambios en el sistema judicial perjudicarían a las futuras inversiones en nearshoring, dice la agencia calificadora.",Economia,https://expansion.mx/economia/2024/09/11/moodys-reforma-judicial-calificacion-mexico,12/09/2024
Expansión,Coparmex advierte que reforma judicial afectará proyectos clave para la economía,"El organismo empresarial lamenta la aprobación en el Senado de la República, señaló que es una decisión que no tomó en cuenta las diferentes voces.",Economia,https://expansion.mx/economia/2024/09/11/reforma-judicial-coparmex,11/09/2024
Expansión,El peso mexicano se mantiene bajo las 20 unidades por dólar,"Tras la aprobación de la reforma judicial y la baja en la inflación en EU, la moneda se apreció 1.48% frente a las 20.09 unidades por dólar reportadas al cierre del martes.",Economia,https://expansion.mx/economia/2024/09/11/peso-mexicano-a-dolar-hoy-11-septiembre-cierre,11/09/2024
